question_title,votes,tags
"What does the ""yield"" keyword do in Python?",12878,pythoniteratorgeneratoryield
"What does if __name__ == ""__main__"": do?",8196,pythonnamespacesprogram-entry-pointpython-moduleidioms
Does Python have a ternary conditional operator?,7901,pythonoperatorsconditional-operator
What are metaclasses in Python?,7364,pythonoopmetaclasspython-classpython-datamodel
How do I check whether a file exists without exceptions?,7123,pythonfilefile-exists
How do I merge two dictionaries in a single expression in Python?,6917,pythondictionarymerge
How do I execute a program or call a system command?,6111,pythonshellterminalsubprocesscommand
"How do I create a directory, and any missing parent directories?",5643,pythonexceptionpathdirectoryoperating-system
How to access the index value in a 'for' loop?,5421,pythonloopslist
How do I make a flat list out of a list of lists?,5317,pythonlistmultidimensional-arrayflatten
What is the difference between @staticmethod and @classmethod in Python?,4641,pythonoopstatic-methodspython-decoratorsclass-method
How slicing in Python works,4583,pythonslicesequence
How to find the index for a given item in a list?,4385,pythonlistindexing
Iterating over dictionaries using 'for' loops,4304,pythondictionary
How can I iterate over rows in a Pandas DataFrame?,4075,pythonpandasdataframeloops
How to use a global variable in a function?,3948,pythonglobal-variablesscope
How do I get the current time in Python?,3853,pythondatetimetime
"How to catch multiple exceptions in one line? (in the ""except"" block)",3823,pythonexception
How to copy files,3793,pythonfilecopyfilesystemsfile-copying
Convert bytes to a string in Python 3,3751,pythonstringpython-3.x
What is __init__.py for?,3730,pythonmodulepackagepython-packaging
What is the difference between __str__ and __repr__?,3689,pythonmagic-methodsrepr
Does Python have a string 'contains' substring method?,3587,pythonstringsubstringcontains
How can I add new keys to a dictionary?,3523,pythondictionarylookup
How do I select rows from a DataFrame based on column values?,3504,pythonpandasdataframe
How do I list all files of a directory?,3466,pythondirectory
How do I sort a dictionary by value?,3413,pythonsortingdictionary
"""Least Astonishment"" and the Mutable Default Argument",3413,pythonlanguage-designdefault-parametersleast-astonishment
What does ** (double star/asterisk) and * (star/asterisk) do for parameters?,3379,pythonsyntaxparameter-passingvariadic-functionsargument-unpacking
How can I delete a file or folder in Python?,3376,pythonfile-iodirectorydelete-file
How do I pass a variable by reference?,3295,pythonreferenceparameter-passingpass-by-reference
How do I clone a list so that it doesn't change unexpectedly after assignment?,3289,pythonlistclonemutable
How can I access environment variables in Python?,3243,pythonenvironment-variables
How do I concatenate two lists in Python?,3238,pythonlistconcatenation
How do I check if a list is empty?,3227,pythonlist
Manually raising (throwing) an exception in Python,3227,pythonexception
How do I make a time delay? [duplicate],3218,pythondelaysleeptimedelay
Understanding Python super() with __init__() methods [duplicate],3218,pythonclassoopinheritancesuper
How do I change the size of figures drawn with Matplotlib?,3201,pythonpandasmatplotlibseabornfigsize
How do I print colored text to the terminal?,3185,pythonterminaloutputansi-colors
How do I make function decorators and chain them together?,3156,pythonfunctiondecoratorpython-decoratorschain
What is the difference between Python's list methods append and extend?,3111,pythonlistdata-structuresappendextend
How do I split a list into equally-sized chunks?,3111,pythonlistsplitchunks
"Why is ""1000000000000000 in range(1000000000000001)"" so fast in Python 3?",3010,pythonperformancepython-3.xrangepython-internals
Find the current directory and file's directory [duplicate],2995,pythondirectory
Renaming column names in Pandas,2957,pythonpandasreplacedataframerename
"Convert string ""Jun 1 2005 1:33PM"" into datetime",2954,pythondatetime
How can I remove a key from a Python dictionary?,2890,pythondictionaryunset
How to sort a list of dictionaries by a value of the dictionary in Python?,2776,pythonlistsortingdictionarydata-structures
How to upgrade all Python packages with pip,2775,pythonpip
